{
  "schemaVersion": "1.0",
  "operationId": "op.1",
  "version": "1.0.0",
  "behavior": "query",
  "inputSchemaRef": "in",
  "outputSchemaRef": "out",
  "preconditions": [],
  "postconditions": [],
  "domainRejections": [],
  "technicalErrors": [],
  "sideEffects": [],
  "idempotency": "idempotent",
  "timeoutClass": "short",
  "cancellable": false,
  "artifactTypes": [],
  "provenanceFields": []
}
